[
 {
  "id": "notice-2026-07-19-01",
  "종류": "공지",
  "제목": "우리팀 공간을 열었습니다",
  "본문": [
   "팀 공지와 브리핑이 이 화면에 쌓입니다. 카톡과 달리 지난 공지가 묻히지 않고 남아서, 필요할 때 다시 찾아볼 수 있습니다.",
   "새 공지가 올라오면 카톡 팀방에 링크로 공유됩니다. 링크를 누르면 이 화면이 열립니다.",
   "다음 단계에서는 읽음 확인, 학습 이수 현황, 질문·경험 나눔이 추가될 예정입니다.",
   "이 공간에서 고객을 언급할 때는 실명 대신 고객 코드(C-YYYY-NNN)를 사용합니다."
  ],
  "작성일": "2026-07-19",
  "작성자": "안창민",
  "연결": []
 }
]
